<?xml version="1.0" encoding="UTF-8"?>
<session xmlns:xsi="http://www.w3.org/2001/XMLSchema-instance"
         xsi:noNamespaceSchemaLocation="hipisejm-transcript-schema.xsd"
         source="filename_from_which_file_was_created.pdf">

  <meta>
    <session_no>1</session_no>
    <term_no>10</term_no>
    <session_date>2023-12-12</session_date>
  </meta>
  <session_officials>
    <official title="speaker" name="Szymon Hołownia"/>
    <official title="vice_speaker" name="Monika Wielichowska"/>
    <!-- Additional officials -->
  </session_officials>
  <content>
    <speech speaker="Marszałek Szymon Hołownia">
      <utt t="norm">What has the speaker said...</utt>
      <utt t="interrupt" by="Someone from the audience">Someone interrupts here...</utt>
      <utt t="norm">...speaker tries to continue...</utt>
      <utt t="reaction">Reaction from the audience</utt>
      <utt t="norm">...speaker finishes.</utt>
      <!-- Continuation of the speech by Jan Kowalski -->
    </speech>
    <!-- Next speeches of other persons -->
  </content>
</session>
